"reporter_name","reporter_location_city","reporter_location_country","reporter_location_latitude","reporter_location_longitude","observation_text","station_location_city","station_location_country","station_location_latitude","station_location_longitude","full_text"
"Indigrah","West Bridgford","","","","Cannot trace; evidently an amateur transmission.","","","","","Indigrah (West Bridgford): Cannot trace; evidently an amateur transmission."
"O-V-1","E. 6","","","","Elberfeld (468.8 m.).","Elberfeld","Germany","51.3","7.0","O-V-1 (E. 6): Elberfeld (468.8 m.)."
"Igranic Seven","","","","","Certainly Spanish by call-sign (hota), Madrid EAJ1.","Madrid","Spain","40.4","-3.7","Igranic Seven: Certainly Spanish by call-sign (hota), Madrid EAJ1."
"J. H. M. O.","County Waterford","Ireland","52.2","-7.1","(1) Surely Barcelona (EAJ1).","Barcelona","Spain","41.4","2.2","J. H. M. O. (County Waterford): (1) Surely Barcelona (EAJ1); (2) Uppsalka is a very small station, but if WL. is correct, can only say that programme tallies as to time and dance music."
"J. H. M. O.","County Waterford","Ireland","52.2","-7.1","(2) Uppsalka is a very small station, but if WL. is correct, can only say that programme tallies as to time and dance music.","Uppsala","Sweden","59.9","17.6","J. H. M. O. (County Waterford): (1) Surely Barcelona (EAJ1); (2) Uppsalka is a very small station, but if WL. is correct, can only say that programme tallies as to time and dance music."
"Ernest E. S. Williams","Wokingham","UK","51.4","-0.8","2GG, amateur (Newbury); 4 O.K. is not a call sign.","Newbury","UK","51.4","-1.3","Ernest E. S. Williams (Wokingham): 2GG, amateur (Newbury); 4 O.K. is not a call sign."
"F. Parker","Berwick-on-Tweed","UK","55.8","-2.0","From other listeners, this transmission was confirmed as given out by Leningrad on 1,165 m. We cannot confirm whether it was the person in question.","Saint Petersburg","Russia","59.9","30.3","F. Parker (Berwick-on-Tweed): From other listeners, this transmission was confirmed as given out by Leningrad on 1,165 m. We cannot confirm whether it was the person in question."
"George","Eastbourne","UK","50.8","0.3","Coupons not enclosed.","","","","","George (Eastbourne): Coupons not enclosed."
"H. G. P.","Portsmouth","UK","50.8","-1.1","Bordeaux (Lafayette) supposed to be on 396 m.","Bordeaux","France","44.8","-0.6","H. G. P. (Portsmouth): Bordeaux (Lafayette) supposed to be on 396 m."
"Drahtlos","Glasgow","UK","55.9","-4.3","Stettin relaying Berlin.","Szczecin","Poland","53.4","14.6","Drahtlos (Glasgow): Stettin relaying Berlin."
"Tuned Anode 3","Hull","UK","53.7","-0.3","Bradford (Clifford Essex Dance Band).","Bradford","UK","53.8","-1.8","Tuned Anode 3 (Hull): Bradford (Clifford Essex Dance Band)."
"H. F. 42","","","","","Leningrad (1,165 m.).","Saint Petersburg","Russia","59.9","30.3","H. F. 42: Leningrad (1,165 m.)."
"Teddy Bear","Castleford","UK","53.7","-1.3","Possibly WLW (Cincinnati-Ohio) 5 kw. (422.3 m.).","Cincinnati","USA","39.1","-84.5","Teddy Bear (Castleford): Possibly WLW (Cincinnati-Ohio) 5 kw. (422.3 m.)."
"W. G. L.","N. 10","","","","(1) Although not advertised in programme, apparently Zurich relaying Berne on 492 m. (Berne relayed a service from the French Church in that city).","Zurich","Switzerland","47.4","8.5","W. G. L. (N. 10): (1) Although not advertised in programme, apparently Zurich relaying Berne on 492 m. (Berne relayed a service from the French Church in that city); (2) Berlin from studio."
"W. G. L.","N. 10","","","","(2) Berlin from studio.","Berlin","Germany","52.5","13.4","W. G. L. (N. 10): (1) Although not advertised in programme, apparently Zurich relaying Berne on 492 m. (Berne relayed a service from the French Church in that city); (2) Berlin from studio."
"H. A. H.","Devonport","UK","50.4","-4.2","Details of transmission are not given in programme, but this appears to tally with Petit Parisien, Paris.","Paris","France","48.9","2.4","H. A. H. (Devonport): Details of transmission are not given in programme, but this appears to tally with Petit Parisien, Paris."
"M.Sc.","Leeds","UK","53.8","-1.5","(2) Karlsborg relaying Stockholm.","Stockholm","Sweden","59.3","18.1","M.Sc. (Leeds): (2) Karlsborg relaying Stockholm; (3) EAJ3, Cadiz (344.8)."
"M.Sc.","Leeds","UK","53.8","-1.5","(3) EAJ3, Cadiz (344.8).","Cadiz","Spain","36.5","-6.3","M.Sc. (Leeds): (2) Karlsborg relaying Stockholm; (3) EAJ3, Cadiz (344.8)."
"Super 8","Sth. Croydon","","","","Cannot trace unless estimated wave-length of transmission is given.","","","","","Super 8 (Sth. Croydon): Cannot trace unless estimated wave-length of transmission is given."